{
  "$schema": "https://json-schema.org/draft/2020-12/schema",
  "$id": "https://raw.githubusercontent.com/farhan6667/wazuh-noiselens/main/noiselens/policy.schema.json",
  "title": "Wazuh NoiseLens policy",
  "description": "A proposed set of suppressions to measure against an exported alerts file, plus the alerts you refuse to hide. This is an analysis contract, not deployable Wazuh XML.",
  "type": "object",
  "required": ["schema_version", "suppressions"],
  "additionalProperties": false,
  "properties": {
    "$schema": { "type": "string" },
    "schema_version": { "const": 1 },
    "protected_level": { "type": "integer", "minimum": 0, "maximum": 16, "default": 12, "description": "Alerts at or above this level are protected. If a suppression matches one, the run exits with 1." },
    "protect_rule_ids": { "type": "array", "items": { "type": "string" }, "description": "Rule IDs that must never be hidden, whatever their level." },
    "suppressions": {
      "type": "array",
      "minItems": 1,
      "description": "Combined with OR. An alert matched by several suppressions is counted once in the overall total.",
      "items": {
        "type": "object",
        "required": ["name", "rule_ids"],
        "additionalProperties": false,
        "properties": {
          "name": { "type": "string", "minLength": 1, "description": "A unique label shown in reports." },
          "rule_ids": { "type": "array", "minItems": 1, "items": { "type": "string" }, "description": "Rule IDs this suppression applies to. A suppression must always name its rules." },
          "equals": {
            "type": "object",
            "description": "Dotted field paths mapped to exact scalar values. Every predicate must match. Case and value type count. Regex, wildcards and null are not supported.",
            "additionalProperties": { "type": ["string", "integer", "boolean"] }
          }
        }
      }
    }
  }
}
